{
  "$schema": "https://json-schema.org/draft/2020-12/schema",
  "$id": "https://gentle-ai.dev/contracts/review-integration/v1/schemas/status.schema.json",
  "title": "Gentle AI Review Integration Target Status v1",
  "type": "object",
  "additionalProperties": false,
  "required": [
    "schema",
    "contract",
    "operation",
    "applicability",
    "receipt",
    "action",
    "replayability",
    "target_identity",
    "projection",
    "candidates"
  ],
  "properties": {
    "schema": { "const": "gentle-ai.review-integration.status/v1" },
    "contract": { "const": "gentle-ai.review-integration/v1" },
    "operation": { "const": "review.status" },
    "applicability": { "enum": ["current_target", "unrelated", "ambiguous", "corrupted"] },
    "authority": {
      "type": "object",
      "additionalProperties": false,
      "required": ["version", "lineage_id", "state", "generation", "revision"],
      "properties": {
        "version": { "enum": ["compact-v2", "legacy-v1"] },
        "lineage_id": { "type": "string", "pattern": "^[a-z0-9]+(?:-[a-z0-9]+)*$" },
        "state": { "type": "string", "minLength": 1 },
        "generation": { "type": "integer", "minimum": 1 },
        "revision": { "$ref": "#/$defs/sha256" }
      }
    },
    "receipt": {
      "type": "object",
      "additionalProperties": false,
      "required": ["status"],
      "properties": {
        "status": { "enum": ["expected_missing", "present", "publication_pending", "not_applicable"] },
        "identity": { "$ref": "#/$defs/sha256" }
      }
    },
    "action": { "enum": ["start", "finalize", "validate", "recover", "maintainer_action", "select_lineage", "repair_authority", "reconcile_finalize", "stop"] },
    "action_disposition": { "enum": ["scope_changed", "invalidated", "escalated"] },
    "replayability": { "enum": ["not_replayable", "exact_replay_safe", "status_required", "manual_action_required"] },
    "frozen": {
      "type": "object",
      "additionalProperties": false,
      "required": ["tier", "original_changed_lines", "correction_budget"],
      "properties": {
        "tier": { "enum": ["low", "medium", "high"] },
        "original_changed_lines": { "type": "integer", "minimum": 0 },
        "correction_budget": { "type": "integer", "minimum": 0, "maximum": 200 }
      }
    },
    "target_identity": { "$ref": "#/$defs/sha256" },
    "projection": { "$ref": "projection.schema.json" },
    "candidates": {
      "type": "array",
      "uniqueItems": true,
      "items": { "type": "string", "pattern": "^[a-z0-9]+(?:-[a-z0-9]+)*$" }
    },
    "reconciliation": {
      "type": "object",
      "additionalProperties": false,
      "required": ["required"],
      "properties": { "required": { "const": true } }
    },
    "eligibility": { "$ref": "#/$defs/action_eligibility" }
  },
  "$defs": {
    "sha256": { "type": "string", "pattern": "^sha256:[0-9a-f]{64}$" },
    "action_eligibility": {
      "type": "object",
      "additionalProperties": false,
      "required": ["allowed_actions", "forbidden_actions"],
      "properties": {
        "allowed_actions": {
          "type": "array",
          "minItems": 1,
          "maxItems": 1,
          "items": {
            "type": "object",
            "additionalProperties": false,
            "required": ["action", "reason_code", "required_inputs"],
            "properties": {
              "action": { "enum": ["stop", "review.start", "review.finalize", "review.validate", "review.recover"] },
              "reason_code": { "type": "string", "pattern": "^[a-z0-9_]+$" },
              "required_inputs": { "type": "array", "items": { "type": "string", "pattern": "^[a-z0-9_]+$" } },
              "disposition": { "enum": ["scope_changed", "invalidated", "escalated"] },
              "binding": {
                "type": "object",
                "additionalProperties": false,
                "required": ["lineage_id", "revision", "target_identity"],
                "properties": {
                  "lineage_id": { "type": "string", "pattern": "^[a-z0-9]+(?:-[a-z0-9]+)*$" },
                  "revision": { "$ref": "#/$defs/sha256" },
                  "target_identity": { "$ref": "#/$defs/sha256" }
                }
              }
            },
            "allOf": [
              {
                "if": { "properties": { "action": { "const": "review.recover" } }, "required": ["action"] },
                "then": { "required": ["disposition", "binding"] },
                "else": { "not": { "anyOf": [{ "required": ["disposition"] }, { "required": ["binding"] }] } }
              }
            ]
          }
        },
        "forbidden_actions": {
          "type": "array",
          "items": {
            "type": "object",
            "additionalProperties": false,
            "required": ["action", "reason_code"],
            "properties": {
              "action": { "enum": ["review.abandon", "review.finalize", "review.invalidate", "review.quarantine-legacy", "review.reclaim", "review.reconcile-authority", "review.recover", "review.start", "review.validate"] },
              "reason_code": { "type": "string", "pattern": "^[a-z0-9_]+$" }
            }
          }
        }
      }
    }
  },
  "allOf": [
    {
      "if": { "properties": { "action": { "const": "reconcile_finalize" } } },
      "then": {
        "required": ["reconciliation"],
        "properties": {
          "applicability": { "const": "current_target" },
          "replayability": { "const": "status_required" }
        }
      },
      "else": { "not": { "required": ["reconciliation"] } }
    },
    {
      "if": { "properties": { "action": { "const": "recover" } }, "required": ["action"] },
      "then": { "required": ["action_disposition"] },
      "else": { "not": { "required": ["action_disposition"] } }
    },
    {
      "if": { "properties": { "applicability": { "const": "current_target" } } },
      "then": { "required": ["authority"] },
      "else": { "not": { "anyOf": [{ "required": ["authority"] }, { "required": ["frozen"] }] } }
    },
    {
      "if": {
        "required": ["authority"],
        "properties": {
          "applicability": { "const": "current_target" },
          "authority": {
            "required": ["version"],
            "properties": { "version": { "const": "compact-v2" } }
          }
        }
      },
      "then": { "required": ["frozen"] }
    },
    {
      "if": {
        "required": ["authority"],
        "properties": {
          "applicability": { "const": "current_target" },
          "authority": {
            "required": ["version"],
            "properties": { "version": { "const": "legacy-v1" } }
          }
        }
      },
      "then": {
        "not": { "required": ["frozen"] },
        "properties": {
          "receipt": {
            "properties": { "status": { "enum": ["expected_missing", "present"] } }
          }
        }
      }
    }
  ]
}
