{
  "schema": "gentle-ai.review-integration.status/v1",
  "contract": "gentle-ai.review-integration/v1",
  "operation": "review.status",
  "applicability": "current_target",
  "authority": {
    "version": "compact-v2",
    "lineage_id": "review-status-fixture",
    "state": "reviewing",
    "generation": 1,
    "revision": "sha256:81cdad8f3182d4919147d3c4fe8f614814068e5ef68417e3dcbd5e326dd3e390"
  },
  "receipt": {
    "status": "expected_missing"
  },
  "action": "finalize",
  "replayability": "not_replayable",
  "frozen": {
    "tier": "medium",
    "original_changed_lines": 2,
    "correction_budget": 1
  },
  "target_identity": "sha256:e6faad1cb9ceb2db170e0ec9ea5394b44c3991dff6cbd02fb6787539715968f6",
  "projection": {
    "schema": "gentle-ai.review-integration.projection/v1",
    "kind": "current-changes",
    "projection": "workspace",
    "base_tree": "3e21a205dd9b55021aeae87965092623807e455f",
    "initial_review_tree": "1c3325617279b38743f073302ba190fc421b5a09",
    "current_candidate_tree": "1c3325617279b38743f073302ba190fc421b5a09",
    "paths_digest": "sha256:b93fca961a97d240c2b7023e98772f49ebd2995eda7db07043270b57bed75d71",
    "paths": [
      "tracked.txt"
    ],
    "intended_untracked": [],
    "intended_untracked_proof": "sha256:b97229718d4c7fe50a8892eb474ae5aa6491697bccb400e3e31dbaca4894d2f3",
    "initial_snapshot_identity": "sha256:e6faad1cb9ceb2db170e0ec9ea5394b44c3991dff6cbd02fb6787539715968f6",
    "current_snapshot_identity": "sha256:e6faad1cb9ceb2db170e0ec9ea5394b44c3991dff6cbd02fb6787539715968f6"
  },
  "candidates": [],
  "eligibility": {
    "allowed_actions": [
      {
        "action": "stop",
        "reason_code": "forbidden_required_inputs_unavailable",
        "required_inputs": []
      }
    ],
    "forbidden_actions": [
      {
        "action": "review.abandon",
        "reason_code": "forbidden_required_inputs_unavailable"
      },
      {
        "action": "review.finalize",
        "reason_code": "forbidden_required_inputs_unavailable"
      },
      {
        "action": "review.invalidate",
        "reason_code": "forbidden_required_inputs_unavailable"
      },
      {
        "action": "review.quarantine-legacy",
        "reason_code": "forbidden_required_inputs_unavailable"
      },
      {
        "action": "review.reclaim",
        "reason_code": "forbidden_required_inputs_unavailable"
      },
      {
        "action": "review.reconcile-authority",
        "reason_code": "forbidden_required_inputs_unavailable"
      },
      {
        "action": "review.recover",
        "reason_code": "forbidden_required_inputs_unavailable"
      },
      {
        "action": "review.start",
        "reason_code": "forbidden_required_inputs_unavailable"
      },
      {
        "action": "review.validate",
        "reason_code": "forbidden_required_inputs_unavailable"
      }
    ]
  }
}
